Название,Цена,Ссылка,Описание,Просмотров,Дата публикации,Продавец,Адрес,О помещении
"Свободного назначения, 46.8 м²",3300000,https://www.avito.ru/samara/kommercheskaya_nedvizhimost/svobodnogo_naznacheniya_46.8_m_3441075278,"Продается помещение с отдельным входом, с арендатором, первая линия улицы Партизанская и Борская, подойдёт как арендный бизнес и как помещение для различных видов деятельности.",-,-,no,-,{}
"Свободного назначения, 50 м²",2250000,https://www.avito.ru/samara/kommercheskaya_nedvizhimost/svobodnogo_naznacheniya_50_m_3284709066,Окна во двор. Помещение офисного типа. Вход в офис через подъезд дома. Отдельного входа нет. Две комнаты 22.2 кв. М. И 16.7 кв. М. Есть туалетная комната (только для этого помещения).,-,-,no,-,{}
"Производство, 420 м²",3990000,https://www.avito.ru/samara/kommercheskaya_nedvizhimost/proizvodstvo_420_m_2872339342,Продам производственное/складское помещение. Охраняемая асфальтированная территория. Все коммуникации. Электричество 380. Отопление газ. Есть возможность увеличения площади. Есть офисные помещения. Торг приветствуется. Рассрочка без участия банков. Рассматриваем обмен на автотранспорт.,-,-,no,-,{}
"Офис, 40.7 м²",5100000,https://www.avito.ru/samara/kommercheskaya_nedvizhimost/ofis_40.7_m_2520081659,"Продам нежилое помещение с отдельным входом на 1 этаже 10этажного дома, вход из подъезда также имеется. Отличный свежий ремонт. 2 комнаты по 15м2. Санузел. Выделенная мощность 15квт. Рядом парковка. Густонаселенный массив высотных домов в Октябрьском районе г. Самары. Офисные центры, столовые, департаменты Самарской области, детские центры, стоматологии и другие. Есть Арендаторы.",-,-,no,-,{}
"Свободного назначения, 72 м²",5400000,https://www.avito.ru/samara/kommercheskaya_nedvizhimost/svobodnogo_naznacheniya_72_m_2255007351,"Продаем помещение на цокольном этаже. Помещение с окнами, холл и 2 полноценных кабинета, с/у. Помещение с ремонтом. Отдельный вход.",-,-,no,-,{}
"Продам офисное помещение, 27 м²",1580000,https://www.avito.ru/samara/kommercheskaya_nedvizhimost/prodam_ofisnoe_pomeschenie_27_m_2476321243,"В продаже офис в центре города в Октябрьском районе на пересечении улиц Гаражная и Революционная. Офис на 3 этаже в пятиэтажном офисном здании. Не угловой, теплый, светлый. В здании системы охранной и пожарной сигнализации. Отличные соседи, чистый и ухоженный этаж. Высокий автомобильный и пешеходный трафик, в ближайшем окружении — несколько крупных строящихся жилых комплексов, развязка Московское шоссе / Революционная. Все эти факторы обеспечивают хорошие условия для ведения бизнеса торговли и услуг. Бесплатно поможем с оформлением ипотеки. Звоните! Покажу в удобное для вас время.",-,-,no,-,{}
"Свободного назначения, 220 м²",5950000,https://www.avito.ru/samara/kommercheskaya_nedvizhimost/svobodnogo_naznacheniya_220_m_3322635850,"Коммерческое -Цокольное. Помещение 220 М. Кв. Чистое( стены, потолки все покрашены), Сухое( не затапливается, не мокнет) Тёплое ( чугунные батарей во всех помещениях). Все занято арендаторами(3), договора долгосрочные. Два отдельных входа( возможно ещё один пристроить). Центральное водоснабжение- водоотведения, отопление, электричество. Два отдельных С/У, умывальники, вытяжка. Торг.",-,-,no,-,{}
"Гостиница, Сауна, офис, дом",3300000,https://www.avito.ru/samara/kommercheskaya_nedvizhimost/gostinitsa_sauna_ofis_dom_2878741226,"2-х этажное отдельностоящее здание 106 кв. М., бывшая сауна. Есть бетонная чаша бассейна. Назначение: нежилое помещение. Вода заведена, законсервирована необходимо заключать договор, газ — на руках тех. Условия внесена предоплата 50%, Эл-во 12 квт можно увеличить. На территории большая асфальт. Площадка, склады, есть ж/д тупик. Можно все дополнительно арендовать. Требуется кап. Ремонт. Подойдет под гостиницу, офис, жилой дом, возможна оплата с ндс.",-,-,no,-,{}
"Свободного назначения, 140 м²",5900000,https://www.avito.ru/samara/kommercheskaya_nedvizhimost/svobodnogo_naznacheniya_140_m_3443372003,"Коммерческое помещение, расположено в доме по ул. Тухачевского. 82. Цокольное, с Окнами! Отличная планировка. Черновая отделка. Есть ещё помещение площадью 45 м2 в этом же доме. Торг возможен!",-,-,no,-,{}
"Офис, 12 м²",2500000,https://www.avito.ru/samara/kommercheskaya_nedvizhimost/ofis_12_m_3640003472,"Продается готовый офис в ЖК «Панорама». Помещение располагается на 2-ом этаже, отдельный вход. Офис полностью оборудован мебелью, офисной техникой. Проведен телефон, интернет. Возможно провести телевидение. Возможна продажа без мебели и техники.",-,-,no,-,{}
"Офис, 47.2 м²",4200000,https://www.avito.ru/samara/kommercheskaya_nedvizhimost/ofis_47.2_m_3392740058,"Продаю помещение на 8-м этаже в офисном центре «Таганка». В офисном центре 2 лифта (пассажирский и грузовой). Помещение разделено перегородками из гипсокартона и перголами из дерева на 3 кабинета, зону ожидания, зону приема пищи и санузел. Сделан качественный ремонт в светло-серых тонах, потолок Армстронг, установлен кондиционер, выполнено грамотное электроснабжение всех зон. Помещение светлое и уютное. Есть действующие арендаторы («Miledium beauty studio»), с которыми заключен долгосрочный договор.",-,-,no,-,{}
"Продам помещение свободного назначения, 121 м²",6900000,https://www.avito.ru/samara/kommercheskaya_nedvizhimost/prodam_pomeschenie_svobodnogo_naznacheniya_121_m_3341800611,"Предлагаем в покупку универсальное помещение, в черновой отделке в историческом центре города. Окна выходят на улицу Максима Горького. Подойдет под любой бизнес. Есть подвал сухой, отапливаемый, под площадью всего помещения. В доме полностью заменены общедомовые коммуникации. Покажем в любое время. Срочная продажа. В шаговой доступности старая набережная р. Волга.",-,-,no,-,{}
"Свободного назначения, 236.3 м²",5900000,https://www.avito.ru/samara/kommercheskaya_nedvizhimost/svobodnogo_naznacheniya_236.3_m_3516300643,"Сухое, теплое, есть разводка под санузел. Имеется два окна на улицу, в одном проеме можно оборудовать еще одну входную зону с улицы. Помещение готово к ремонту под нужды нового собственника, подрядчик имеется. Возможна сдача в аренду. Я собственник, прямая продажа. Форма оплаты-любая, по договоренности. В услугах риэлторов не нуждаюсь.",-,-,no,-,{}
"Офис, 173 м² ул.Мичурина",8700000,https://www.avito.ru/samara/kommercheskaya_nedvizhimost/ofis_173_m_ul.michurina_3643005015,"Продаётся офисное помещение с арендаторами, заполнено на 100%. Общая площадь: 173 кв. М. Пол- кeрaмогрaнит, пoтолок- apмcтрoнг, стены — под покpаcку, Два санузла. Помещения оборудованы кондиционерами и видеонаблюдением. Выделенная мощность 10 квт. Oчeнь оживленное меcтo, с удобными проездами. Рядом мнoжеcтво oфиcов и торговых помещений. Район с большим скоплением многоэтажных домов, в месте концентрации объектов коммерческой деятельности.",-,-,no,-,{}
"Продам помещение свободного назначения, 70 м²",2300000,https://www.avito.ru/samara/kommercheskaya_nedvizhimost/prodam_pomeschenie_svobodnogo_naznacheniya_70_m_3198114176,"Очень интересное и выгодное предложение! В помещении выполнен качественный ремонт, заменены все коммуникации, в том числе отопление, водоснабжение, электропроводка, приборы учета, установлены пластиковые окна, распашные решетки, железные входные двери, рольставни, по проекту организован отдельный вход. По периметру дома и в подъезде установлена дорогая система видеонаблюдения, с возможностью дистанционного контроля со смартфона (стоимость видеонаблюдения оговаривается отдельно). Помещение состоит из четырех основных комнат, три из которых полностью отремонтированы. Две комнаты — офисное пространство (плюс серверная-кладовка), третья комната отведена под сауну, душевую, санузел, а четвертая комната не доделана и ожидает вашего решения. Помещение в собственности, договора с коммунальными службами в порядке. Прямая продажа. Любые формы оплаты. Рассмотрим обмен, взаимозачет. Показ по предварительной договоренности.",-,-,no,-,{}
"Здание, 359.4 м²",1600000,https://www.avito.ru/samara/kommercheskaya_nedvizhimost/zdanie_359.4_m_3682217298,Продаётся помещение ресторана / кафе (ранее ресторан Старый Георг). 3/10 доли в праве. В настоящее время не функционирует. Дополнительная информация по телефону. Показ в удобное для обеих сторон время.,-,-,no,-,{}
Высокодоходный арендный бизнес 40 м²,6280000,https://www.avito.ru/samara/kommercheskaya_nedvizhimost/vysokodohodnyy_arendnyy_biznes_40_m_3304570259,"Продается нежилое помещение на одном из самых оживленных перекрестков в Самаре ул. Авроры\Дыбенко. Рядом пешеходный переход. Помещение на 1м этаже общей площадью 40 кв. М. С отдельным входом, представляет собой большой холл и отдельный санузел. Все окна и вход выходят на проезжую часть. Имеется место под рекламу на фасаде помещения. Высокий автомобильный и пешеходный трафик. Помещение уже более 8 лет сдано одному и тому же постоянному арендатору годовой арендный поток 625тыс. Ежегодная индексация 10 %. Все коммунальные (в том числе содержание имущества, текущий и капитальный ремонты, отопление, водоснабжение и электричество) оплачиваются арендатором сверх арендной платы. Окупаемость проекта менее 10 лет. Налог на имущество за 2022г 1132 рубля. Риэлторов просьба не беспокоить. Комиссию не плачу.",-,-,no,-,{}
"Свободного назначения, 129.1 м²",8900000,https://www.avito.ru/samara/kommercheskaya_nedvizhimost/svobodnogo_naznacheniya_129.1_m_3841862727,"Продам нежилое помещение общей площадью 129,1 кв м, за ТЦ «Эль-Рио» на Московском шоссе. Последнее время использовалось под магазин детской одежды. Торг! Обменные варианты! Показ в удобное для вас время! Доп информация по телефону.",-,-,no,-,{}
"Свободного назначения, 200 м²",85000,https://www.avito.ru/samara/kommercheskaya_nedvizhimost/svobodnogo_naznacheniya_200_m_3549937433,"Продам помещение свободного назначения общей площадью 200м2 идеально под семейное кафе или пекарню (кулинарию). Имеется второй этаж, высокие потолки. Центральное отопление, Хвс, Гвс, канализация (самотечная), электроэнергия, пожарная охрана. Вход как во двор, так и на первую линию ул. Стара-Загора, плотный пешеходный и автомобильный трафик, густо заселенней район. Продажа от собственника.",-,-,no,-,{}
Арендный бизнес (офисные помещения 263.7 м²),9600000,https://www.avito.ru/samara/kommercheskaya_nedvizhimost/arendnyy_biznes_ofisnye_pomescheniya_263.7_m_2867435815,"! Г О Р Я Ч Е Е П Р Е Д Л О Ж Е Н И Е М Е С Я Ц А! Только сейчас и в этом месяце! Стоимость 9 600 000 р. (36 405р/м2) действует до 30.12.2023 г. Продается нежилое помещение 263,7 кв. М, как арендный бизнес или под офис компании в г. Самара на первой линии ул. Ново-Вокзальная,116. Пересечение Ново-вокзальная//Стара-Загора. Помещение расположено в административном трехэтажном здании на 3-м этаже с отдельным входом в офисное крыло. Состоит из 9 кабинетов с разной площадью от 12 кв. М до 29 кв. М. Все кабинеты с ремонтом. Высота потолков -3,3 м. Санузел на этаже. Уборка проводится по графику. Здание находиться под охраной. Есть возможность размещения рекламы на фасаде. Большая парковка во дворе здания. Окупаемость помещения 9,5 лет. Все кабинеты в аренде и приносят хороший ежемесячный доход. Возможно, рассмотреть покупку под свой собственный бизнес. Звоните, пишите, с удовольствием ответим на все Ваши вопросы!",-,-,no,-,{}
Арендный бизнес на 1 линии. Парковка у входа,5200000,https://www.avito.ru/samara/kommercheskaya_nedvizhimost/arendnyy_biznes_na_1_linii._parkovka_u_vhoda_2911660193,"Адрес: г. Самара. Октябрьский район, ул. Московское шоссе, 126а. Ближайшее пересечение с улицей 22 партсъезда. Общая площадь: 38,2 кв. М. Этаж/этажность: 1/1. Назначение здания: нежилое. - Отдельный вход с Московского шоссе. - Окна выходят: на улицу. - Парковка перед входом. - Возможность разгрузки грузовых машин. - Место под рекламу на фасаде помещения. Высота потолков: 2,6 м. Планировка: торговый зал, кабинет, санузел. Выделенная мощность: 15 квт. В ближайшем окружении располагаются: Парк Гагарина, Парк Хаус, туристический магазин, свадебный салон, Гибдд, автосервисы, колледж. В настоящий момент помещение сдано в аренду и приносит стабильный доход. Стоимость продажи: 5 200 000 рублей (136 000 р. /кв. М). Емельянов Артём. Без какой либо комиссии для покупателя!",-,-,no,-,{}
Двухэтажное офисное помещение в центре города,6500000,https://www.avito.ru/samara/kommercheskaya_nedvizhimost/dvuhetazhnoe_ofisnoe_pomeschenie_v_tsentre_goroda_3039188532,"Адрес: г. Самара, Ленинский район, улица Осипенко, д. 39. Ближайшее пересечение с улицей Чернореченская. Общая площадь: 85 кв. М. Общая площадь 1 этажа 55 кв. М. Общая площадь цоколя 30 кв. М. Высота потолков: 2,5 м. Этаж/этажность: 1/10. Назначение помещения: нежилое. Кабинетная система, (возможна перепланировка). Ремонт в помещении: пол — линолеум ; стены — покраска; потолок: — натяжной и арм-стронг. Окна выходят в большой проходимый двор высотных домов. Большое наличие парковочных мест, большой пешеходный трафик. В цокольном этаже имеется окно в приямке с естественным светом. Входная группа располагается во дворе, через подъезд. Возможна реклама на фасаде. Инфраструктура: офисные помещения, салон красоты, тату салон, аптека «Вита» и др. Возможное использование: офис, магазин, салон красоты, стоматология, детский клуб. Стоимость: 6 500 000 руб. (76 470 руб. /кв. М.). Без какой либо комиссии для покупателя! Сенилов Максим.",-,-,no,-,{}
"Склад, 69 м²",550000,https://www.avito.ru/samara/kommercheskaya_nedvizhimost/sklad_69_m_3512104989,"Собственник продаст помещение под склад, небольшое производство или офис. Отдельный вход, асфальтированная территория. Земля в аренде. Автономное отопление (газ), электричество. Перегородки при необходимости убираются. Разумный обоснованный торг.",-,-,no,-,{}
Продажа 63м2 отдельный вход,3600000,https://www.avito.ru/samara/kommercheskaya_nedvizhimost/prodazha_63m2_otdelnyy_vhod_3253106612,"Продается помещение с отдельным входом 63 кв. М., в цокольном этаже одноэтажного здания по адресу: Самара, Самарский район, ул. Молодогвардейская, 116. От собственника, без комиссии. Основные характеристики и преимущества помещения: - в собственности, свидетельство (нежилое помещение); - отдельный вход; - цоколь с полноценными окнами (4 окна). - располагается в близи от остановок общественного транспорта, на пересечении улиц Молодогвардейская/Льва Толстого/Некрасовская/Чапаевская; -деловой, исторический центр города; -в непосредственной близости от Набережной р. Волга; - доступ 24/7; - кондиционеры; - сан узел; - косметический ремонт: полы паркет, потолки армстронг 2,0 -2,5 м, стены под покраску; -помещение с арендатором; Стоимость помещения 3 600 000 руб. По всем вопросам можете обратиться к специалисту. Яговитова Анастасия. «Регион Бизнес Недвижимость». Арт. 50887858.",-,-,no,-,{}
"Помещение свободного назначения, 178.7 м²",950000,https://www.avito.ru/samara/kommercheskaya_nedvizhimost/pomeschenie_svobodnogo_naznacheniya_178.7_m_1959061968,"Подвальное помещение, черновая отделка.",-,-,no,-,{}
Свободного назначения с отдельным входом,4200000,https://www.avito.ru/samara/kommercheskaya_nedvizhimost/svobodnogo_naznacheniya_s_otdelnym_vhodom_3889945106,"Продается помещение свободного назначения, 22 кв. М. Ремонт, вложений не требует. Возможность размещения рекламной вывески. Выделенная мощность электричества=380 Квт. Изолированный вход со стороны улицы, доступ 24/7. Пожарная и охранная сигнализация. Вода холодная/горячая, санузел.",145,сегодня в 07:13,Компания,-,"{'вход': 'с улицы', 'общая площадь': '22 м²', 'этаж': '1', 'отделка': 'чистовая', 'тип сделки': 'продажа'}"
